{
  "$schema": "https://json-schema.org/draft/2020-12/schema",
  "$id": "https://platform-contracts.invoice.internal/ingestion/schemas/transaction-request.schema.json",
  "title": "TransactionRequest",
  "description": "Request body of POST /v1/transactions (SDS §19.2, FR-M.2), reused transaction-by-transaction inside POST /v1/batches (FR-M.8) and as the base of POST /v1/issuances (FR-AE.2). Field names mirror canonical/openapi.yaml's RecordDocumentRequest/Party/Line/Totals one-for-one (canonical calls the parties object \"parties\"; this public resource calls it \"counterparty\", SDS §19.2's own term) so the two sides of the ingestion-svc -> canonical-svc sync edge never drift. entityRef is checked against the caller's token scope (API-24) rather than carried as a separate tenantId, since tenant and entity scope come from the token on the public surface.",
  "type": "object",
  "properties": {
    "entityRef": { "type": "string", "maxLength": 40 },
    "sourceSystem": { "type": "string", "maxLength": 60 },
    "sourceKey": {
      "type": "string",
      "maxLength": 128,
      "description": "Part of the idempotency pair (API-13, API-15, FR-M.3)."
    },
    "sourceRevision": {
      "type": "integer",
      "minimum": 1,
      "description": "Part of the idempotency pair (API-15, FR-M.3). Lower than already recorded is ING-002."
    },
    "documentFunction": {
      "type": "string",
      "enum": ["INVOICE", "CREDIT_NOTE", "DEBIT_NOTE", "BILL_FOR_PAYMENT"]
    },
    "documentNumber": {
      "type": "string",
      "maxLength": 100,
      "description": "Required when documentFunction is BILL_FOR_PAYMENT (ING-009); otherwise omitted (API-14)."
    },
    "transactionDate": { "type": "string", "format": "date" },
    "currency": { "type": "string", "minLength": 3, "maxLength": 3 },
    "counterparty": {
      "type": "object",
      "properties": {
        "supplier": { "$ref": "#/$defs/party" },
        "buyer": { "$ref": "#/$defs/party" }
      },
      "required": ["supplier", "buyer"]
    },
    "lines": {
      "type": "array",
      "maxItems": 10000,
      "items": { "$ref": "#/$defs/line" }
    },
    "declaredTotals": { "$ref": "#/$defs/totals" },
    "precedingDocumentNumber": {
      "type": "string",
      "maxLength": 64,
      "description": "Preceding Invoice Number (IBT-025): the number of the invoice a credit note corrects, where the original is known (INV-REQ-560). Optional; a number without precedingDocumentDate is valid, canonical-svc looks the original up or raises RUL-008 (INV-REQ-701)."
    },
    "precedingDocumentDate": {
      "type": "string",
      "format": "date",
      "description": "Preceding Invoice Date (IBT-026): the date of the invoice a credit note corrects, where the original is known (INV-REQ-560). The credit note resolves its rate and category code from this date (INV-REQ-701)."
    },
    "precedingBlankJustification": {
      "type": "string",
      "maxLength": 512,
      "description": "Why a credit note leaves precedingDocumentNumber and precedingDocumentDate blank, e.g. a volume rebate not attributable to one invoice; notes that a rate-change straddle was considered (INV-REQ-561, INV-REQ-702). Required, with evidenceRef, on a credit note sent with neither preceding field (INV-Q-1677)."
    },
    "evidenceRef": {
      "type": "string",
      "maxLength": 256,
      "description": "Reference to the business's other documentary evidence that GST was accounted for on the original supplies, for a blank-linked credit note (INV-REQ-561). Required with precedingBlankJustification under the same condition (INV-Q-1677)."
    }
  },
  "required": ["entityRef", "sourceSystem", "sourceKey", "sourceRevision", "documentFunction", "transactionDate", "currency", "lines"],
  "$defs": {
    "party": {
      "type": "object",
      "properties": {
        "identifierScheme": { "type": "string", "maxLength": 20 },
        "identifierValue": { "type": "string", "maxLength": 60 }
      },
      "required": ["identifierScheme", "identifierValue"]
    },
    "line": {
      "type": "object",
      "properties": {
        "lineNumber": { "type": "integer", "minimum": 1 },
        "description": { "type": "string", "maxLength": 500 },
        "quantity": { "type": "number" },
        "unitPrice": {
          "type": "string",
          "format": "decimal",
          "pattern": "^-?\\d{1,17}(\\.\\d{1,6})?$",
          "description": "Money as a decimal string, up to 6 places (API-12)."
        },
        "lineAmount": {
          "type": "string",
          "format": "decimal",
          "pattern": "^-?\\d{1,17}(\\.\\d{1,2})?$",
          "description": "Money as a decimal string, decimal(19,2) (API-12)."
        },
        "taxCode": { "type": "string", "maxLength": 10 },
        "taxAmount": {
          "type": "string",
          "format": "decimal",
          "pattern": "^-?\\d{1,17}(\\.\\d{1,2})?$",
          "description": "Money as a decimal string, decimal(19,2) (API-12)."
        }
      },
      "required": ["lineNumber", "lineAmount"]
    },
    "totals": {
      "type": "object",
      "properties": {
        "totalExcludingTax": { "type": "string", "format": "decimal", "pattern": "^-?\\d{1,17}(\\.\\d{1,2})?$" },
        "totalTax": { "type": "string", "format": "decimal", "pattern": "^-?\\d{1,17}(\\.\\d{1,2})?$" },
        "totalIncludingTax": { "type": "string", "format": "decimal", "pattern": "^-?\\d{1,17}(\\.\\d{1,2})?$" }
      },
      "required": ["totalExcludingTax", "totalTax", "totalIncludingTax"]
    }
  }
}
