{
  "entityRef": "E-001",
  "sourceSystem": "erp-acme",
  "sourceKey": "CN-2027-000045",
  "sourceRevision": 1,
  "documentFunction": "DEBIT_NOTE",
  "transactionDate": "2027-02-15",
  "currency": "SGD",
  "counterparty": {
    "supplier": {
      "identifierScheme": "UEN",
      "identifierValue": "201912345A"
    },
    "buyer": {
      "identifierScheme": "UEN",
      "identifierValue": "201954321B"
    }
  },
  "lines": [
    {
      "lineNumber": 1,
      "description": "Credit for consulting services",
      "quantity": 1,
      "unitPrice": "1000.00",
      "lineAmount": "1000.00",
      "taxCode": "SR",
      "taxAmount": "90.00"
    }
  ],
  "declaredTotals": {
    "totalExcludingTax": "1000.00",
    "totalTax": "90.00",
    "totalIncludingTax": "1090.00"
  },
  "precedingDocumentNumber": "INV-100",
  "precedingDocumentDate": "2027-01-10"
}
